{
  "schemaVersion": 1,
  "contractVersion": 1,
  "languageId": "javascript",
  "title": "JavaScript Code Quest",
  "quests": [
    {
      "id": "quest-javascript-delivery-fee",
      "slug": "delivery-fee-policy",
      "revision": 2,
      "order": 1,
      "lessonId": "js-02-values-control-flow",
      "conceptIds": ["js.operators", "js.control-flow"],
      "difficulty": "beginner",
      "estimatedMinutes": 15,
      "title": "배송비 정책 계산하기",
      "summary": "여러 조건의 우선순위를 나누어 기본 배송비와 도서 지역 추가 요금을 계산합니다.",
      "instructions": "`calculateDeliveryFee(orderTotal, destination, hasMembership)` 함수를 완성하세요. 기본 배송비는 3,000원입니다. 일반 회원은 주문 금액이 50,000원 이상이면, 멤버십 회원은 30,000원 이상이면 기본 배송비가 무료입니다. `destination`이 `\"island\"`이면 주문 금액이나 멤버십과 관계없이 도서 지역 추가 요금 5,000원을 더합니다. 최종 배송비를 number로 반환하세요.",
      "functionContract": {
        "parameters": [
          {
            "name": "orderTotal",
            "type": "integer",
            "description": "0 이상 1,000,000 이하인 주문 금액입니다."
          },
          {
            "name": "destination",
            "type": "\"standard\" | \"island\"",
            "description": "일반 배송 지역 또는 도서 지역을 나타냅니다."
          },
          {
            "name": "hasMembership",
            "type": "boolean",
            "description": "멤버십 회원이면 true입니다."
          }
        ],
        "returns": {
          "type": "integer",
          "description": "기본 배송비와 필요한 추가 요금을 합친 최종 배송비입니다."
        },
        "constraints": [
          "모든 인수는 설명된 타입과 범위로 전달됩니다.",
          "무료 기준 금액은 일반 회원 50,000원, 멤버십 회원 30,000원입니다.",
          "도서 지역 추가 요금 5,000원은 기본 배송비 무료 여부와 별도로 항상 적용됩니다."
        ],
        "complexity": {
          "time": "O(1)",
          "space": "O(1)"
        }
      },
      "entryPoint": "calculateDeliveryFee",
      "starterCode": "function calculateDeliveryFee(orderTotal, destination, hasMembership) {\n  // 1. 회원 유형에 맞는 무료 배송 기준을 정하세요.\n  // 2. 기본 배송비와 도서 지역 추가 요금을 따로 계산하세요.\n  return 0;\n}\n",
      "examples": [
        {
          "args": [50000, "island", false],
          "expected": 5000,
          "explanation": "일반 회원의 기본 배송비는 무료이지만 도서 지역 추가 요금은 남습니다."
        }
      ],
      "publicTests": [
        {
          "id": "delivery-standard-paid",
          "label": "일반 회원 무료 기준 바로 아래",
          "args": [49999, "standard", false],
          "expected": 3000
        },
        {
          "id": "delivery-minimum-island",
          "label": "최소 주문 금액의 도서 지역 배송",
          "args": [0, "island", false],
          "expected": 8000
        },
        {
          "id": "delivery-member-below-threshold",
          "label": "멤버십 무료 기준 바로 아래",
          "args": [29999, "standard", true],
          "expected": 3000
        },
        {
          "id": "delivery-member-at-threshold",
          "label": "멤버십 무료 기준과 같은 금액의 도서 지역 배송",
          "args": [30000, "island", true],
          "expected": 5000
        },
        {
          "id": "delivery-regular-at-threshold-island",
          "label": "일반 회원 무료 기준의 도서 지역 배송",
          "args": [50000, "island", false],
          "expected": 5000
        },
        {
          "id": "delivery-member-standard-at-threshold",
          "label": "멤버십 무료 기준과 같은 금액의 일반 지역 배송",
          "args": [30000, "standard", true],
          "expected": 0
        }
      ],
      "failureExplanations": [
        {
          "testId": "delivery-standard-paid",
          "message": "일반 회원은 50,000원 바로 아래까지 기본 배송비 3,000원이 필요합니다."
        },
        {
          "testId": "delivery-minimum-island",
          "message": "주문 금액이 0원이어도 기본 배송비와 도서 지역 추가 요금을 모두 계산해야 합니다."
        },
        {
          "testId": "delivery-member-below-threshold",
          "message": "멤버십 여부만으로 무료가 되지 않습니다. 주문 금액도 30,000원 이상인지 확인하세요."
        },
        {
          "testId": "delivery-member-at-threshold",
          "message": "경계값 30,000원에서는 기본 배송비만 무료이고 도서 지역 추가 요금 5,000원은 남아야 합니다."
        },
        {
          "testId": "delivery-regular-at-threshold-island",
          "message": "기본 배송비가 무료여도 도서 지역 추가 요금 5,000원은 남아야 합니다."
        },
        {
          "testId": "delivery-member-standard-at-threshold",
          "message": "일반 지역에서도 멤버십 회원은 경계값 30,000원부터 기본 배송비가 무료입니다."
        }
      ],
      "hints": [
        {
          "level": 1,
          "stage": "concept",
          "title": "조건을 역할별로 나누기",
          "content": "기본 배송비가 무료인지 판단하는 조건과 도서 지역인지 판단하는 조건은 서로 다른 정책입니다."
        },
        {
          "level": 2,
          "stage": "observation",
          "title": "경계값을 표로 비교하기",
          "content": "멤버십 여부에 따라 무료 기준을 먼저 하나의 숫자로 정한 뒤 29,999원과 30,000원의 결과를 비교해 보세요."
        },
        {
          "level": 3,
          "stage": "implementation",
          "title": "기본 요금 뒤에 추가 요금 더하기",
          "content": "무료 기준으로 기본 배송비를 정하고, 그 결과와 별개로 `destination`이 `\"island\"`인지 검사해 추가 요금을 더해 보세요."
        }
      ],
      "commonMistakes": [
        {
          "id": "combined-fee-condition",
          "title": "회원 여부와 추가 요금을 한 조건으로 처리하기",
          "explanation": "멤버십 회원이라는 사실만으로 곧바로 0원을 반환하거나 무료 배송일 때 함수를 끝내면, 금액 기준과 도서 지역 추가 요금을 놓칩니다."
        },
        {
          "id": "membership-threshold-by-destination",
          "title": "회원 기준을 배송 지역 기준으로 바꾸기",
          "explanation": "무료 배송 기준은 destination이 아니라 hasMembership으로 결정해야 합니다. 일반 지역에서도 멤버십 회원에게 30,000원 기준을 적용하세요."
        }
      ]
    },
    {
      "id": "quest-javascript-number-path",
      "slug": "number-path",
      "revision": 1,
      "order": 2,
      "lessonId": "js-04-collections",
      "conceptIds": ["js.arrays"],
      "difficulty": "beginner",
      "estimatedMinutes": 20,
      "title": "양방향 숫자 경로 만들기",
      "summary": "시작값과 끝값의 방향에 맞춰 증가하거나 감소하는 반복문의 경계를 설계합니다.",
      "instructions": "`buildNumberPath(start, end, step)` 함수를 완성하세요. 결과 배열은 `start`를 먼저 담고, `end`가 더 크면 `step`만큼 증가하고 더 작으면 `step`만큼 감소합니다. 다음 값이 `end`를 지나기 전까지만 배열에 담습니다. 이동 중 `end`에 정확히 도달하면 그 값도 포함합니다. `step`은 항상 양수입니다.",
      "functionContract": {
        "parameters": [
          {
            "name": "start",
            "type": "integer",
            "description": "-100 이상 100 이하인 시작값입니다."
          },
          {
            "name": "end",
            "type": "integer",
            "description": "-100 이상 100 이하인 끝 경계입니다."
          },
          {
            "name": "step",
            "type": "integer",
            "description": "1 이상 20 이하인 양의 이동 간격입니다."
          }
        ],
        "returns": {
          "type": "integer[]",
          "description": "시작값부터 끝 경계를 넘기 전까지의 숫자를 순서대로 담은 배열입니다."
        },
        "constraints": [
          "start와 end는 -100 이상 100 이하인 정수입니다.",
          "step은 1 이상 20 이하인 정수이며 항상 양수입니다.",
          "start와 end가 같으면 start 하나만 담은 배열을 반환합니다."
        ],
        "complexity": {
          "time": "O(d / step + 1), d = |start - end|",
          "space": "O(d / step + 1), d = |start - end|"
        }
      },
      "entryPoint": "buildNumberPath",
      "starterCode": "function buildNumberPath(start, end, step) {\n  const path = [];\n\n  // start와 end의 방향에 맞는 반복 조건을 작성하세요.\n\n  return path;\n}\n",
      "examples": [
        {
          "args": [9, 0, 4],
          "expected": [9, 5, 1],
          "explanation": "9에서 4씩 감소하면 9, 5, 1이고 다음 값 -3은 끝 경계 0을 지나므로 담지 않습니다."
        }
      ],
      "publicTests": [
        {
          "id": "path-same-point",
          "label": "시작값과 끝값이 같은 경우",
          "args": [0, 0, 5],
          "expected": [0]
        },
        {
          "id": "path-ascending-exact",
          "label": "증가하며 끝값에 정확히 도달",
          "args": [1, 7, 2],
          "expected": [1, 3, 5, 7]
        },
        {
          "id": "path-ascending-before-overrun",
          "label": "증가하다 끝 경계를 넘기 전에 정지",
          "args": [2, 9, 3],
          "expected": [2, 5, 8]
        },
        {
          "id": "path-descending-exact",
          "label": "감소하며 끝값에 정확히 도달",
          "args": [8, 2, 3],
          "expected": [8, 5, 2]
        },
        {
          "id": "path-descending-before-overrun",
          "label": "감소하다 끝 경계를 넘기 전에 정지",
          "args": [9, 0, 4],
          "expected": [9, 5, 1]
        },
        {
          "id": "path-full-range-maximum-step",
          "label": "최솟값부터 최댓값까지 최대 간격으로 이동",
          "args": [-100, 100, 20],
          "expected": [-100, -80, -60, -40, -20, 0, 20, 40, 60, 80, 100]
        }
      ],
      "failureExplanations": [
        {
          "testId": "path-same-point",
          "message": "이동하지 않더라도 시작값은 결과에 한 번 포함해야 합니다."
        },
        {
          "testId": "path-ascending-exact",
          "message": "증가 경로에서 끝값에 정확히 도달하면 끝값도 포함하도록 `<=` 경계를 확인하세요."
        },
        {
          "testId": "path-ascending-before-overrun",
          "message": "다음 값이 끝 경계를 넘으면 그 값은 결과에 추가하지 않아야 합니다."
        },
        {
          "testId": "path-descending-exact",
          "message": "감소 경로는 현재 값이 끝값보다 크거나 같은 동안 반복해야 합니다."
        },
        {
          "testId": "path-descending-before-overrun",
          "message": "감소할 때는 step을 더하지 말고 빼며, 끝 경계를 지난 값은 제외하세요."
        },
        {
          "testId": "path-full-range-maximum-step",
          "message": "음수에서 양수로 이동해도 같은 증가 경계와 간격 규칙을 적용해야 합니다."
        }
      ],
      "hints": [
        {
          "level": 1,
          "stage": "concept",
          "title": "반복 방향 먼저 결정하기",
          "content": "start와 end를 비교하면 값을 더해야 하는지 빼야 하는지 알 수 있습니다."
        },
        {
          "level": 2,
          "stage": "observation",
          "title": "포함되는 마지막 값 확인하기",
          "content": "증가 경로의 `current < end`와 `current <= end`가 끝값에 정확히 도달할 때 어떤 차이를 만드는지 손으로 적어 보세요."
        },
        {
          "level": 3,
          "stage": "implementation",
          "title": "방향별 반복문 작성하기",
          "content": "증가와 감소를 두 분기로 나누고, 각 분기에서 현재 값을 담은 뒤 step을 더하거나 빼는 반복문을 작성해 보세요."
        }
      ],
      "commonMistakes": [
        {
          "id": "ascending-only-loop",
          "title": "증가 방향과 미포함 경계만 처리하기",
          "explanation": "`current < end`인 증가 반복문 하나만 작성하면 같은 값, 끝값 포함, 감소 경로를 모두 처리하지 못합니다."
        }
      ]
    },
    {